<?xml version="1.0" encoding="UTF-8"?>
<listaDomande xmlns:xsi="http://www.w3.org/2001/XMLSchema-instance" xsi:noNamespaceSchemaLocation="Domande.xsd">
    <domanda id="D1">
        <nomeAutore>Giovanni</nomeAutore>
        <cognomeAutore>Rossi</cognomeAutore>
        <codFiscAutore>RSSGNN64R03E472G</codFiscAutore>
        <categoria>Generale</categoria>
        <testoDomanda>La palestra e' dotata di un phon?</testoDomanda>
        <listaRisposte>
            <risposta>
                <idRisposta>D1-RSP1</idRisposta>
                <autore>Cliente</autore>
                <nomeAutoreRisposta>Roberto</nomeAutoreRisposta>
                <cognomeAutoreRisposta>Verdi</cognomeAutoreRisposta>
                <codFiscAutoreRisposta>VRDRRT00L13E472M</codFiscAutoreRisposta>
                <testoRisposta>Si, certo</testoRisposta>
            </risposta>
        </listaRisposte>
    </domanda>
    <domanda id="D2">
        <nomeAutore>Roberto</nomeAutore>
        <cognomeAutore>Verdi</cognomeAutore>
        <codFiscAutore>VRDRRT00L13E472M</codFiscAutore>
        <categoria>Servizi</categoria>
        <testoDomanda>Posso usufruire del servizio in camera anche se ho prenotato una camera Standard Singola?</testoDomanda>
        <listaRisposte />            
    </domanda>
</listaDomande>
